Channel Darter,Lake Ontario populations,Channel Darter (Lake Ontario populations),Endangered,2016-11-27,Percina copelandi,Channel Darter,Lake Ontario populations,Endangered,2019-08-08,Schedule 1,2006-04-06,Ontario,Fishes (freshwater),,Uplisted: Threatened to endangered
Channel Darter,St. Lawrence populations,Channel Darter (St. Lawrence populations),Special Concern,2016-11-27,Percina copelandi,Channel Darter,St. Lawrence populations,Special Concern,2019-08-08,Schedule 1,2006-04-06,"Ontario, Quebec",Fishes (freshwater),,Downlisted: Threatened to special concern
Cherry Birch,,Cherry Birch,Endangered,2006-04-29,Betula lenta,Cherry Birch,,Endangered,2007-12-13,Schedule 1,2007-12-13,Ontario,Vascular Plants,,Added to list
Chestnut Lamprey,,Chestnut Lamprey,Non-active,2010-11-26,Ichthyomyzon castaneus,Chestnut Lamprey,,,,,,"Manitoba, Saskatchewan",Fishes (freshwater),,
Chestnut Lamprey,Great Lakes - Upper St. Lawrence populations,Chestnut Lamprey (Great Lakes - Upper St. Lawrence populations),Data Deficient,2010-11-26,Ichthyomyzon castaneus,Chestnut Lamprey,Great Lakes - Upper St. Lawrence populations,,,,,"Ontario, Quebec",Fishes (freshwater),,
Chestnut Lamprey,Saskatchewan - Nelson River populations,Chestnut Lamprey (Saskatchewan - Nelson River populations),Data Deficient,2010-11-26,Ichthyomyzon castaneus,Chestnut Lamprey,Saskatchewan - Nelson River populations,,,,,"Manitoba, Ontario, Saskatchewan",Fishes (freshwater),,
Chestnut-collared Longspur,,Chestnut-collared Longspur,Endangered,2019-11-29,Calcarius ornatus,Chestnut-collared Longspur,,Threatened,,Schedule 1,2012-06-20,"Alberta, Manitoba, Saskatchewan",Birds,Status change,Pending
Chimney Swift,,Chimney Swift,Threatened,2018-04-27,Chaetura pelagica,Chimney Swift,,Threatened,2009-03-05,Schedule 1,2009-03-05,"Manitoba, New Brunswick, Nova Scotia, Ontario, Quebec, Saskatchewan",Birds,,Added to list
Chinook Salmon,"East Vancouver Island, Ocean, Fall (EVI + SFj) population","Chinook Salmon (East Vancouver Island, Ocean, Fall (EVI + SFj) population)",Not at Risk,2020-11-04,Oncorhynchus tshawytscha,,,No Status,,No schedule,,"British Columbia, Pacific Ocean",Fishes (marine),,
Chinook Salmon,"East Vancouver Island, Ocean, Fall population","Chinook Salmon (East Vancouver Island, Ocean, Fall population)",Special Concern,2020-11-04,Oncorhynchus tshawytscha,Chinook Salmon,"East Vancouver Island, Ocean, Fall population",No Status,,No schedule,,"British Columbia, Pacific Ocean",Fishes (marine),Addition,Pending
Chinook Salmon,"East Vancouver Island, Ocean, Summer population","Chinook Salmon (East Vancouver Island, Ocean, Summer population)",Endangered,2020-11-04,Oncorhynchus tshawytscha,Chinook Salmon,"East Vancouver Island, Ocean, Summer population",No Status,,No schedule,,"British Columbia, Pacific Ocean",Fishes (marine),Addition,Pending
Chinook Salmon,"East Vancouver Island, Stream, Spring population","Chinook Salmon (East Vancouver Island, Stream, Spring population)",Endangered,2018-11-01,Oncorhynchus tshawytscha,Chinook Salmon,"East Vancouver Island, Stream, Spring population",No Status,,No schedule,,"British Columbia, Pacific Ocean",Fishes (marine),Addition,Pending
Chinook Salmon,"Lower Fraser, Ocean, Fall population","Chinook Salmon (Lower Fraser, Ocean, Fall population)",Threatened,2018-11-01,Oncorhynchus tshawytscha,Chinook Salmon,"Lower Fraser, Ocean, Fall population",No Status,,No schedule,,"British Columbia, Pacific Ocean",Fishes (marine),Addition,Pending
Chinook Salmon,"Lower Fraser, Ocean, Summer population","Chinook Salmon (Lower Fraser, Ocean, Summer population)",Endangered,2020-11-04,Oncorhynchus tshawytscha,Chinook Salmon,"Lower Fraser, Ocean, Summer population",No Status,,No schedule,,"British Columbia, Pacific Ocean",Fishes (marine),Addition,Pending
Chinook Salmon,"Lower Fraser, Stream, Spring population","Chinook Salmon (Lower Fraser, Stream, Spring population)",Special Concern,2018-11-01,Oncorhynchus tshawytscha,Chinook Salmon,"Lower Fraser, Stream, Spring population",No Status,,No schedule,,"British Columbia, Pacific Ocean",Fishes (marine),Addition,Pending
Chinook Salmon,"Lower Fraser, Stream, Summer (Upper Pitt) population","Chinook Salmon (Lower Fraser, Stream, Summer (Upper Pitt) population)",Endangered,2018-11-01,Oncorhynchus tshawytscha,Chinook Salmon,"Lower Fraser, Stream, Summer (Upper Pitt) population",No Status,,No schedule,,"British Columbia, Pacific Ocean",Fishes (marine),Addition,Pending
Chinook Salmon,"Lower Fraser, Stream, Summer population","Chinook Salmon (Lower Fraser, Stream, Summer population)",Threatened,2018-11-01,Oncorhynchus tshawytscha,Chinook Salmon,"Lower Fraser, Stream, Summer population",No Status,,No schedule,,"British Columbia, Pacific Ocean",Fishes (marine),Addition,Pending
Chinook Salmon,"Lower Thompson, Stream, Spring population","Chinook Salmon (Lower Thompson, Stream, Spring population)",Endangered,2020-11-04,Oncorhynchus tshawytscha,Chinook Salmon,"Lower Thompson, Stream, Spring population",No Status,,No schedule,,"British Columbia, Pacific Ocean",Fishes (marine),Addition,Pending
Chinook Salmon,"Middle Fraser, Stream, Fall population","Chinook Salmon (Middle Fraser, Stream, Fall population)",Endangered,2018-11-01,Oncorhynchus tshawytscha,Chinook Salmon,"Middle Fraser, Stream, Fall population",No Status,,No schedule,,"British Columbia, Pacific Ocean",Fishes (marine),Addition,Pending
Chinook Salmon,"Middle Fraser, Stream, Spring (MFR+GStr) population","Chinook Salmon (Middle Fraser, Stream, Spring (MFR+GStr) population)",Threatened,2018-11-01,Oncorhynchus tshawytscha,Chinook Salmon,"Middle Fraser, Stream, Spring (MFR+GStr) population",No Status,,No schedule,,"British Columbia, Pacific Ocean",Fishes (marine),Addition,Pending
Chinook Salmon,"Middle Fraser, Stream, Spring population","Chinook Salmon (Middle Fraser, Stream, Spring population)",Endangered,2018-11-01,Oncorhynchus tshawytscha,Chinook Salmon,"Middle Fraser, Stream, Spring population",No Status,,No schedule,,"British Columbia, Pacific Ocean",Fishes (marine),Addition,Pending
Chinook Salmon,"Middle Fraser, Stream, Summer population","Chinook Salmon (Middle Fraser, Stream, Summer population)",Threatened,2018-11-01,Oncorhynchus tshawytscha,Chinook Salmon,"Middle Fraser, Stream, Summer population",No Status,,No schedule,,"British Columbia, Pacific Ocean",Fishes (marine),Addition,Pending
Chinook Salmon,"North Thompson, Stream, Spring population","Chinook Salmon (North Thompson, Stream, Spring population)",Endangered,2018-11-01,Oncorhynchus tshawytscha,Chinook Salmon,"North Thompson, Stream, Spring population",No Status,,No schedule,,"British Columbia, Pacific Ocean",Fishes (marine),Addition,Pending
Chinook Salmon,"North Thompson, Stream, Summer population","Chinook Salmon (North Thompson, Stream, Summer population)",Endangered,2018-11-01,Oncorhynchus tshawytscha,Chinook Salmon,"North Thompson, Stream, Summer population",No Status,,No schedule,,"British Columbia, Pacific Ocean",Fishes (marine),Addition,Pending
Chinook Salmon,Okanagan population,Chinook Salmon (Okanagan population),Endangered,2017-04-28,Oncorhynchus tshawytscha,Chinook Salmon,Okanagan population,No Status,,No schedule,,"British Columbia, Pacific Ocean",Fishes (marine),Addition,Pending
Chinook Salmon,"South Coast - Georgia Strait, Ocean, Fall population","Chinook Salmon (South Coast - Georgia Strait, Ocean, Fall population)",Data Deficient,2020-11-04,Oncorhynchus tshawytscha,,,No Status,,No schedule,,"British Columbia, Pacific Ocean",Fishes (marine),,
Chinook Salmon,"South Coast - Southern Fjords, Ocean, Fall population","Chinook Salmon (South Coast - Southern Fjords, Ocean, Fall population)",Data Deficient,2020-11-04,Oncorhynchus tshawytscha,,,No Status,,No schedule,,"British Columbia, Pacific Ocean",Fishes (marine),,
Chinook Salmon,"South Thompson, Ocean, Summer population","Chinook Salmon (South Thompson, Ocean, Summer population)",Not at Risk,2018-11-01,Oncorhynchus tshawytscha,,,No Status,,No schedule,,"British Columbia, Pacific Ocean",Fishes (marine),,
Chinook Salmon,"South Thompson, Stream, Summer 1.2 population","Chinook Salmon (South Thompson, Stream, Summer 1.2 population)",Endangered,2018-11-01,Oncorhynchus tshawytscha,Chinook Salmon,"South Thompson, Stream, Summer 1.2 population",No Status,,No schedule,,"British Columbia, Pacific Ocean",Fishes (marine),Addition,Pending
Chinook Salmon,"South Thompson, Stream, Summer 1.3 population","Chinook Salmon (South Thompson, Stream, Summer 1.3 population)",Endangered,2020-11-04,Oncorhynchus tshawytscha,Chinook Salmon,"South Thompson, Stream, Summer 1.3 population",No Status,,No schedule,,"British Columbia, Pacific Ocean",Fishes (marine),Addition,Pending
Chinook Salmon,"Southern Mainland Boundary Bay, Ocean, Fall population","Chinook Salmon (Southern Mainland Boundary Bay, Ocean, Fall population)",Threatened,2020-11-04,Oncorhynchus tshawytscha,Chinook Salmon,"Southern Mainland Boundary Bay, Ocean, Fall population",No Status,,No schedule,,"British Columbia, Pacific Ocean",Fishes (marine),Addition,Pending
Chinook Salmon,"Southern Mainland, Ocean, Summer population","Chinook Salmon (Southern Mainland, Ocean, Summer population)",Data Deficient,2018-11-01,Oncorhynchus tshawytscha,,,No Status,,No schedule,,"British Columbia, Pacific Ocean",Fishes (marine),,
Chinook Salmon,"Southern Mainland, Stream, Summer population","Chinook Salmon (Southern Mainland, Stream, Summer population)",Data Deficient,2018-11-01,Oncorhynchus tshawytscha,,,No Status,,No schedule,,"British Columbia, Pacific Ocean",Fishes (marine),,
Chinook Salmon,"Upper Fraser, Stream, Spring population","Chinook Salmon (Upper Fraser, Stream, Spring population)",Endangered,2018-11-01,Oncorhynchus tshawytscha,Chinook Salmon,"Upper Fraser, Stream, Spring population",No Status,,No schedule,,"British Columbia, Pacific Ocean",Fishes (marine),Addition,Pending
Chinook Salmon,"West Vancouver Island, Ocean, Fall (Nootka & Kyuquot) population","Chinook Salmon (West Vancouver Island, Ocean, Fall (Nootka & Kyuquot) population)",Threatened,2020-11-04,Oncorhynchus tshawytscha,Chinook Salmon,"West Vancouver Island, Ocean, Fall (Nootka & Kyuquot) population",No Status,,No schedule,,"British Columbia, Pacific Ocean",Fishes (marine),Addition,Pending
Chinook Salmon,"West Vancouver Island, Ocean, Fall (South) population","Chinook Salmon (West Vancouver Island, Ocean, Fall (South) population)",Threatened,2020-11-04,Oncorhynchus tshawytscha,Chinook Salmon,"West Vancouver Island, Ocean, Fall (South) population",No Status,,No schedule,,"British Columbia, Pacific Ocean",Fishes (marine),Addition,Pending
Chinook Salmon,"West Vancouver Island, Ocean, Fall (WVI + WQCI) population","Chinook Salmon (West Vancouver Island, Ocean, Fall (WVI + WQCI) population)",Data Deficient,2020-11-04,Oncorhynchus tshawytscha,,,No Status,,No schedule,,"British Columbia, Pacific Ocean",Fishes (marine),,
Chiselmouth,,Chiselmouth,Not at Risk,2003-05-01,Acrocheilus alutaceus,,,No Status,,No schedule,,British Columbia,Fishes (freshwater),,
Cleland’s Evening-primrose,,Cleland’s Evening-primrose,Endangered,2023-12-01,Oenothera clelandii,Cleland’s Evening-primrose,,No Status,,No schedule,,Ontario,Vascular Plants,Addition,Pending
Cliff Paintbrush,,Cliff Paintbrush,Threatened,2005-05-05,Castilleja rupicola,Cliff Paintbrush,,Threatened,2006-08-15,Schedule 1,2006-08-15,British Columbia,Vascular Plants,,Added to list
Climbing Prairie Rose,,Climbing Prairie Rose,Special Concern,2003-05-01,Rosa setigera,Climbing Prairie Rose,,Special Concern,2005-01-12,Schedule 1,2005-01-12,Ontario,Vascular Plants,,Added to list
Coast Microseris,,Coast Microseris,Endangered,2006-04-29,Microseris bigelovii,Coast Microseris,,Endangered,2007-12-13,Schedule 1,2007-12-13,British Columbia,Vascular Plants,,Added to list
Coastal Giant Salamander,,Coastal Giant Salamander,Threatened,2014-05-02,Dicamptodon tenebrosus,Coastal Giant Salamander,,Threatened,2003-06-05,Schedule 1,2003-06-05,British Columbia,Amphibians,,Added to list
Coastal Manroot,,Coastal Manroot,Endangered,2022-12-03,Marah oregana,Coastal Manroot,,No Status,,No schedule,,British Columbia,Vascular Plants,Addition,Pending
Coastal Scouler's Catchfly,,Coastal Scouler's Catchfly,Endangered,2003-05-01,Silene scouleri ssp. grandis,Coastal Scouler's Catchfly,,Endangered,2005-01-12,Schedule 1,2005-01-12,British Columbia,Vascular Plants,,Added to list
Coastal Tailed Frog,,Coastal Tailed Frog,Special Concern,2011-11-25,Ascaphus truei,Coastal Tailed Frog,,Special Concern,2003-06-05,Schedule 1,2003-06-05,British Columbia,Amphibians,,Added to list
Coastal Vesper Sparrow,,Coastal Vesper Sparrow,Endangered,2018-04-27,Pooecetes gramineus affinis,Coastal Vesper Sparrow,,Endangered,2007-12-13,Schedule 1,2007-12-13,British Columbia,Birds,,Added to list
Coastal Wood Fern,,Coastal Wood Fern,Special Concern,2021-05-05,Dryopteris arguta,Coastal Wood Fern,,Special Concern,2003-06-05,Schedule 1,2003-06-05,British Columbia,Vascular Plants,,Added to list
Coastrange Sculpin,Cultus Lake population,Coastrange Sculpin (Cultus Lake population),Endangered,2019-11-29,Cottus aleuticus,Coastrange Sculpin,Cultus population,Threatened,,Schedule 1,2003-06-05,British Columbia,Fishes (freshwater),Status change,Pending
Cobblestone Tiger Beetle,,Cobblestone Tiger Beetle,Special Concern,2021-05-05,Cicindela marginipennis,Cobblestone Tiger Beetle,,Endangered,,Schedule 1,2011-02-04,New Brunswick,Arthropods,Status change,Pending
Coeur d'Alene Salamander,,Coeur d'Alene Salamander,Special Concern,2021-05-05,Plethodon idahoensis,Coeur d'Alene Salamander,,Special Concern,2003-06-05,Schedule 1,2003-06-05,British Columbia,Amphibians,,Added to list
Coho Salmon,Interior Fraser population,Coho Salmon (Interior Fraser population),Threatened,2016-11-27,Oncorhynchus kisutch,Coho Salmon,Interior Fraser population,No Status,,No schedule,,"British Columbia, Pacific Ocean",Fishes (marine),Addition,Pending
Colicroot,,Colicroot,Endangered,2015-11-26,Aletris farinosa,Colicroot,,Endangered,2019-02-25,Schedule 1,2003-06-05,Ontario,Vascular Plants,,Uplisted: Threatened to endangered
Collared Pika,,Collared Pika,Special Concern,2011-11-25,Ochotona collaris,Collared Pika,,Special Concern,2017-02-03,Schedule 1,2017-02-03,"British Columbia, Northwest Territories, Yukon",Mammals (terrestrial),,Added to list
Columbia Dune Moth,,Columbia Dune Moth,Data Deficient,2017-04-28,Copablepharon absidum,,,No Status,,No schedule,,British Columbia,Arthropods,,
Columbia Quillwort,,Columbia Quillwort,Endangered,2019-05-03,Isoetes minima,Columbia Quillwort,,Endangered,2023-02-03,Schedule 1,2023-02-03,British Columbia,Vascular Plants,,Added to list
Columbia Sculpin,,Columbia Sculpin,Special Concern,2019-11-29,Cottus hubbsi,Columbia Sculpin,,Special Concern,2003-06-05,Schedule 1,2003-06-05,British Columbia,Fishes (freshwater),,Added to list
Columbia Spotted Frog,,Columbia Spotted Frog,Not at Risk,2000-05-01,Rana luteiventris,,,No Status,,No schedule,,"Alberta, British Columbia, Yukon",Amphibians,,
Columbian Carpet Moss,,Columbian Carpet Moss,Special Concern,2014-11-28,Bryoerythrophyllum columbianum,Columbian Carpet Moss,,Special Concern,2005-07-14,Schedule 1,2005-07-14,British Columbia,Mosses,,Added to list
Common Bottlenose Dolphin,,Common Bottlenose Dolphin,Not at Risk,1993-04-01,Tursiops truncatus,,,No Status,,No schedule,,Atlantic Ocean,Mammals (marine),,
Common Hoptree,,Common Hoptree,Special Concern,2015-11-26,Ptelea trifoliata,Common Hoptree,,Special Concern,2019-02-25,Schedule 1,2005-01-12,Ontario,Vascular Plants,,Downlisted: Threatened to special concern
Common Loon,,Common Loon,Not at Risk,1997-04-01,Gavia immer,,,No Status,,No schedule,,"Alberta, British Columbia, Manitoba, New Brunswick, Newfoundland and Labrador, Northwest Territories, Nova Scotia, Nunavut, Ontario, Prince Edward Island, Quebec, Saskatchewan, Yukon",Birds,,
Common Minke Whale North Atlantic subspecies,,Common Minke Whale North Atlantic subspecies,Not at Risk,2006-04-29,Balaenoptera acutorostrata acutorostrata,,,No Status,,No schedule,,Atlantic Ocean,Mammals (marine),,
Common Minke Whale North Pacific subspecies,,Common Minke Whale North Pacific subspecies,Not at Risk,2006-04-29,Balaenoptera acutorostrata scammonii,,,No Status,,No schedule,,Pacific Ocean,Mammals (marine),,
Common Nighthawk,,Common Nighthawk,Special Concern,2018-04-27,Chordeiles minor,Common Nighthawk,,Special Concern,2023-02-03,Schedule 1,2010-02-23,"Alberta, British Columbia, Manitoba, New Brunswick, Newfoundland and Labrador, Northwest Territories, Nova Scotia, Nunavut, Ontario, Prince Edward Island, Quebec, Saskatchewan, Yukon",Birds,,Downlisted: Threatened to special concern
Common Poorwill,,Common Poorwill,Data Deficient,1993-04-01,Phalaenoptilus nuttallii,,,No Status,,No schedule,,"Alberta, British Columbia, Saskatchewan",Birds,,
Common Tern,,Common Tern,Not at Risk,1998-04-01,Sterna hirundo,,,No Status,,No schedule,,"Alberta, Manitoba, New Brunswick, Newfoundland and Labrador, Northwest Territories, Nova Scotia, Ontario, Prince Edward Island, Quebec, Saskatchewan",Birds,,
Contorted-pod Evening-primrose,,Contorted-pod Evening-primrose,Endangered,2006-04-29,Camissonia contorta,Contorted-pod Evening-primrose,,Endangered,2007-12-13,Schedule 1,2007-12-13,British Columbia,Vascular Plants,,Added to list
Cooper's Hawk,,Cooper's Hawk,Not at Risk,1996-04-01,Accipiter cooperii,,,No Status,,No schedule,,"Alberta, British Columbia, Manitoba, New Brunswick, Nova Scotia, Ontario, Quebec, Saskatchewan",Birds,,
Cope's Grey Treefrog,,Cope's Grey Treefrog,Not at Risk,1999-04-01,Hyla chrysoscelis,,,No Status,,No schedule,,Manitoba,Amphibians,,
Copper Redhorse,,Copper Redhorse,Endangered,2014-05-02,Moxostoma hubbsi,Copper Redhorse,,Endangered,2007-12-13,Schedule 1,2007-12-13,Quebec,Fishes (freshwater),,Added to list
Cordilleran Sucker,,Cordilleran Sucker,Threatened,2022-12-03,Pantosteus bondi,Cordilleran Sucker,,No Status,,No schedule,,British Columbia,Fishes (freshwater),Addition,Pending
Cougar,Eastern population,Cougar (Eastern population),Data Deficient,1998-04-01,Puma concolor couguar,Cougar,Eastern population,,,No schedule,,"New Brunswick, Nova Scotia, Ontario, Quebec",Mammals (terrestrial),,
Crooked-stem Aster,,Crooked-stem Aster,Special Concern,2012-11-25,Symphyotrichum prenanthoides,Crooked-stem Aster,,Special Concern,2018-02-02,Schedule 1,2005-01-12,Ontario,Vascular Plants,,Downlisted: Threatened to special concern
Crumpled Tarpaper Lichen,,Crumpled Tarpaper Lichen,Threatened,2010-11-26,Collema coniophilum,Crumpled Tarpaper Lichen,,Threatened,2017-02-03,Schedule 1,2017-02-03,British Columbia,Lichens,,Added to list
Cryptic Paw Lichen,,Cryptic Paw Lichen,Threatened,2019-05-03,Nephroma occultum,Cryptic Paw Lichen,,Special Concern,,Schedule 1,2007-12-13,British Columbia,Lichens,Status change,Pending
Cucumber Tree,,Cucumber Tree,Endangered,2010-04-25,Magnolia acuminata,Cucumber Tree,,Endangered,2003-06-05,Schedule 1,2003-06-05,Ontario,Vascular Plants,,Added to list
Cusk,,Cusk,Endangered,2012-11-25,Brosme brosme,Cusk,,No Status,,No schedule,,Atlantic Ocean,Fishes (marine),Addition,Pending
Cutlip Minnow,,Cutlip Minnow,Special Concern,2013-11-01,Exoglossum maxillingua,Cutlip Minnow,,Special Concern,2019-08-08,Schedule 1,2019-08-08,"Ontario, Quebec",Fishes (freshwater),,Added to list
Cuvier's Beaked Whale,,Cuvier's Beaked Whale,Not at Risk,1990-04-01,Ziphius cavirostris,,,No Status,,No schedule,,"Atlantic Ocean, Pacific Ocean",Mammals (marine),,
Dakota Skipper,,Dakota Skipper,Endangered,2014-05-02,Hesperia dacotae,Dakota Skipper,,Endangered,2018-02-02,Schedule 1,2005-07-14,"Manitoba, Saskatchewan",Arthropods,,Uplisted: Threatened to endangered
Dall's Porpoise,,Dall's Porpoise,Not at Risk,1989-04-01,Phocoenoides dalli,,,No Status,,No schedule,,Pacific Ocean,Mammals (marine),,
Dalton’s Moss,,Dalton’s Moss,Endangered,2019-05-03,Daltonia splachnoides,Dalton’s Moss,,Endangered,2023-02-03,Schedule 1,2023-02-03,British Columbia,Mosses,,Added to list
Dark-banded Flower Gem,,Dark-banded Flower Gem,Data Deficient,2005-05-05,Melaporphyria immortua,,,No Status,,No schedule,,"Alberta, Manitoba, Saskatchewan",Arthropods,,
Darkblotched Rockfish,,Darkblotched Rockfish,Special Concern,2009-11-27,Sebastes crameri,Darkblotched Rockfish,,No Status,,No schedule,,Pacific Ocean,Fishes (marine),Addition,Pending
Davis's Shieldback,,Davis's Shieldback,Threatened,2020-11-04,Atlanticus davisi,Davis's Shieldback,,No Status,,No schedule,,Ontario,Arthropods,Addition,Pending
Deepwater Cisco,,Deepwater Cisco,Extinct,2000-05-01,Coregonus johannae,,,No Status,,No schedule,,Ontario,Fishes (freshwater),,
Deepwater Redfish,Gulf of St. Lawrence - Laurentian Channel population,Deepwater Redfish (Gulf of St. Lawrence - Laurentian Channel population),Endangered,2010-04-25,Sebastes mentella,Deepwater Redfish,Gulf of St. Lawrence - Laurentian Channel population,No Status,,No schedule,,Atlantic Ocean,Fishes (marine),Addition,Pending
Deepwater Redfish,Northern population,Deepwater Redfish (Northern population),Threatened,2010-04-25,Sebastes mentella,Deepwater Redfish,Northern population,No Status,,No schedule,,Atlantic Ocean,Fishes (marine),Addition,Pending
Deepwater Sculpin,Great Lakes - Upper St. Lawrence populations,Deepwater Sculpin (Great Lakes - Upper St. Lawrence populations),Special Concern,2017-04-28,Myoxocephalus thompsonii,Deepwater Sculpin,Great Lakes - Western St. Lawrence populations,Special Concern,2007-12-13,Schedule 1,2007-12-13,"Ontario, Quebec",Fishes (freshwater),,Added to list
Deepwater Sculpin,Great Lakes populations,Deepwater Sculpin (Great Lakes populations),Non-active,2006-04-29,Myoxocephalus thompsonii,Deepwater Sculpin,Great Lakes populations,,,,,Ontario,Fishes (freshwater),,
Deepwater Sculpin,Saskatchewan - Nelson River populations,Deepwater Sculpin (Saskatchewan - Nelson River populations),Not at Risk,2017-04-28,Myoxocephalus thompsonii,,,No Status,,No schedule,,"Manitoba, Ontario",Fishes (freshwater),,
Deepwater Sculpin,Southern Hudson Bay - James Bay populations,Deepwater Sculpin (Southern Hudson Bay - James Bay populations),Data Deficient,2017-04-28,Myoxocephalus thompsonii,,,No Status,,No schedule,,Ontario,Fishes (freshwater),,
Deepwater Sculpin,Waterton Lake population,Deepwater Sculpin (Waterton Lake population),Special Concern,2017-04-28,Myoxocephalus thompsonii,Deepwater Sculpin,Waterton Lake population,No Status,,No schedule,,Alberta,Fishes (freshwater),Addition,Pending
Deepwater Sculpin,Western Arctic populations,Deepwater Sculpin (Western Arctic populations),Not at Risk,2017-04-28,Myoxocephalus thompsonii,,,No Status,,No schedule,,"Alberta, Northwest Territories, Saskatchewan",Fishes (freshwater),,
Deepwater Sculpin,Western Hudson Bay populations,Deepwater Sculpin (Western Hudson Bay populations),Not at Risk,2017-04-28,Myoxocephalus thompsonii,,,No Status,,No schedule,,Saskatchewan,Fishes (freshwater),,
Deepwater Sculpin,Western populations,Deepwater Sculpin (Western populations),Non-active,2017-04-28,Myoxocephalus thompsonii,,,No Status,,No schedule,,"Alberta, Manitoba, Northwest Territories, Ontario, Saskatchewan",Fishes (freshwater),,
Deerberry,,Deerberry,Threatened,2020-11-04,Vaccinium stamineum,Deerberry,,Threatened,2003-06-05,Schedule 1,2003-06-05,Ontario,Vascular Plants,,Added to list
DeKay's Brownsnake,,DeKay's Brownsnake,Not at Risk,2002-05-01,Storeria dekayi,,,No Status,,No schedule,,"Ontario, Quebec",Reptiles,,
Delicate Luster Moss,,Delicate Luster Moss,Not at Risk,2006-04-29,Isopterygium tenerum,,,No Status,,No schedule,,Nova Scotia,Mosses,,
Deltoid Balsamroot,,Deltoid Balsamroot,Endangered,2009-04-26,Balsamorhiza deltoidea,Deltoid Balsamroot,,Endangered,2003-06-05,Schedule 1,2003-06-05,British Columbia,Vascular Plants,,Added to list
Dense Blazing Star,,Dense Blazing Star,Threatened,2010-04-25,Liatris spicata,Dense Blazing Star,,Threatened,2003-06-05,Schedule 1,2003-06-05,Ontario,Vascular Plants,,Added to list
Dense Draba,,Dense Draba,Special Concern,2022-05-11,Draba pycnosperma,Dense Draba,,No Status,,No schedule,,"Newfoundland and Labrador, Quebec",Vascular Plants,Addition,Pending
Dense Spike-primrose,,Dense Spike-primrose,Endangered,2005-05-05,Epilobium densiflorum,Dense Spike-primrose,,Endangered,2006-08-15,Schedule 1,2006-08-15,British Columbia,Vascular Plants,,Added to list
Dense-flowered Lupine,,Dense-flowered Lupine,Endangered,2005-05-05,Lupinus densiflorus,Dense-flowered Lupine,,Endangered,2006-08-15,Schedule 1,2006-08-15,British Columbia,Vascular Plants,,Added to list
Desert Nightsnake,,Desert Nightsnake,Endangered,2011-05-06,Hypsiglena chlorophaea,Desert Nightsnake,,Endangered,2003-06-05,Schedule 1,2003-06-05,British Columbia,Reptiles,,Added to list
Dolly Varden,Western Arctic populations,Dolly Varden (Western Arctic populations),Special Concern,2010-11-26,Salvelinus malma malma,Dolly Varden,Western Arctic populations,Special Concern,2017-04-13,Schedule 1,2017-04-13,"Northwest Territories, Yukon",Fishes (freshwater),,Added to list
Double-crested Cormorant,,Double-crested Cormorant,Not at Risk,1978-04-01,Phalacrocorax auritus,,,No Status,,No schedule,,"Alberta, British Columbia, Manitoba, New Brunswick, Newfoundland and Labrador, Northwest Territories, Nova Scotia, Ontario, Prince Edward Island, Quebec, Saskatchewan, Yukon",Birds,,
Downy Yellow False Foxglove,,Downy Yellow False Foxglove,Endangered,2018-04-27,Aureolaria virginica,Downy Yellow False Foxglove,,Endangered,2023-02-03,Schedule 1,2023-02-03,Ontario,Vascular Plants,,Added to list
Dromedary Jumping-slug,,Dromedary Jumping-slug,Threatened,2014-05-02,Hemphillia dromedarius,Dromedary Jumping-slug,,Threatened,2005-01-12,Schedule 1,2005-01-12,British Columbia,Molluscs,,Added to list
Drooping Trillium,,Drooping Trillium,Endangered,2009-04-26,Trillium flexipes,Drooping Trillium,,Endangered,2003-06-05,Schedule 1,2003-06-05,Ontario,Vascular Plants,,Added to list
